Key,Assignee,Summary,Link,Status
IN-2379,llu,UI is messed up when clicked on the same annual cash bonus multiple times,https://jira.equilar.com/rest/api/latest/issue/43057,Resolved
IN-2319,llu,[Pen. Test] Insight security flaws -  Cross-Site Scripting - Improper Neutralization of Script in Attributes in a Web Page (CWE ID 83),https://jira.equilar.com/rest/api/latest/issue/41848,In Code Review
IN-2378,llu,Exchange Rate Conversion Are Not Converted Under Certain Situation,https://jira.equilar.com/rest/api/latest/issue/43053,In Code Review
IN-2377,sgudiseva,Exchange Rate Conversion - Appendix - Report 10102016-01 tab,https://jira.equilar.com/rest/api/latest/issue/43050,In Progress
IN-2356,svangala,Currency conversion is applied in Download Report when the Company and  original currency is CAD,https://jira.equilar.com/rest/api/latest/issue/42756,Resolved
IN-2361,svangala,Data is not seen in Compensation Summary tab after downloading the Pre-run review report ,https://jira.equilar.com/rest/api/latest/issue/42816,Resolved
IN-2367,SNeelakantam,Null pointer exception is logged and reports fails to run in New TCR.,https://jira.equilar.com/rest/api/latest/issue/42879,In Progress
